<?xml version="1.0" encoding="UTF-8"?>
<hivemq-bridge-extension xmlns:xsi="http://www.w3.org/2001/XMLSchema-instance"
                         xsi:noNamespaceSchemaLocation="config.xsd">
    <bridges>
        <bridge>
            <name>test-bridge</name>
            <remote-broker>
                <connection>
                    <static>
                        <host>localhost</host>
                    </static>
                </connection>
            </remote-broker>
            <topics>
                <topic>
                    <filter>+/+/+/+/machine/data</filter>
                </topic>
            </topics>
        </bridge>
    </bridges>
</hivemq-bridge-extension>
